{
  "id": "teacher-conference",
  "title": "Fifteen minutes with the teacher: making a conference count",
  "topic": "SCHOOL",
  "readingTime": "3 MIN READ",
  "byline": "By Nora Lindqvist, MVP staff",
  "body": [
    "Most parent-teacher conferences run fifteen or twenty minutes, and the first five usually go to the teacher's overview. That leaves about ten minutes that are yours, so it helps to walk in knowing what you want from them.",
    "Before you go, ask your child two questions: what is the best part of the day, and what is the hardest part. Children often say things at home that never come up in class, and the teacher will want to hear them. Then write down one or two things you want to understand better. A specific question, such as how your child handles group work or what happens when a math problem gets hard, gets a more useful answer than asking how things are going.",
    "Tell the teacher about anything at home that affects school. A move, a new sibling, a change in activities or a child who is seeing a therapist can all explain what a teacher is noticing, and you decide how much to share.",
    "Before you leave, agree on one thing each of you will do and how you will stay in touch about it. Teachers see a lot of families during conference week, and a short follow-up email a few days later keeps your conversation from getting lost.",
    "If fifteen minutes is not enough, say so and ask for a second meeting. Most teachers would rather schedule one than rush a conversation that matters."
  ]
}
